{
 "claims": {
  "captions": {
   "footer": "SIMULATION computed from the published SBML model; not an observation.  Time and concentrations are non-dimensional (model time).  Two abstract cells: this is not tissue, not a fin, and no cell shape is modelled or observed.",
   "header": "Two-cell Delta-Notch lateral inhibition - BioModels BIOMD0000001047 (Collier et al. 1996) - SIMULATION"
  },
  "does_not_show": [
   "observed cell shape or morphology",
   "tissue",
   "a fin",
   "any flying-fish structure",
   "real time or physical concentration units"
  ],
  "shows": "two-cell Delta-Notch concentrations vs model time and (Notch, Delta) phase portraits for three replay scenarios"
 },
 "dimensions": {
  "dpi": 100,
  "height": 720,
  "width": 1280
 },
 "evidence_kind": "simulated: a rendering of replay output; not an observation of any biological system",
 "inputs": {
  "csv": {
   "trajectory_as_published.csv": {
    "bytes": 57128,
    "rows": 601,
    "scenario": "as_published",
    "sha256": "18d72480c7856d0d8b162e940be66b7afc439001bd09510ef4c69ae984a9ed72"
   },
   "trajectory_no_notch_feedback_b0.csv": {
    "bytes": 57128,
    "rows": 601,
    "scenario": "no_notch_feedback_b0",
    "sha256": "373d6783e5e9b1de7ffd9ef17b7735b0e8a677b6545db4a8e9e09801249a740f"
   },
   "trajectory_symmetric_baseline.csv": {
    "bytes": 57128,
    "rows": 601,
    "scenario": "symmetric_baseline",
    "sha256": "2079523158221f313eea181e3a6ab5fd41260434daf54ccbeeae3b8274ee0d75"
   }
  },
  "model_sha256": "da21ab52edba14b61e41ee87df7a8bb2f367a1206e6e822602f1e75271fae8e2",
  "receipt_sha256": "731a85a6fe893bd10f86196b5fd7101a64810d0d68ae03ebfa4eee3d2e04bc6e",
  "replay_code_sha256": "46954f4ae0e77732db9eadd303b3acb1edd5ca3925dd036cbb132e556df34b6b"
 },
 "manifest_schema": "biomodels-video-manifest-0.1 (connector-local)",
 "poster": {
  "bytes": 125439,
  "file": "delta_notch_replay_poster.png",
  "frame": "last row (model time 60.0), not a separate simulation",
  "height": 720,
  "sha256": "011eb783a77fd560b248c375e83e2e009acbd59ffbeed87eb1270869e08521db",
  "width": 1280
 },
 "render": {
  "code_file": "connectors/biomodels/render.py",
  "code_sha256": "1555f4e4a69ea0cb317201a3fee34017f13dfd6c09a5b79aceb245975c2c28bf",
  "ffmpeg": "ffmpeg version 6.1.1-3ubuntu5 Copyright (c) 2000-2023 the FFmpeg developers",
  "frames_sha256": "7632d36c4b96bf31f7045a5728a8ee32ce979647e95cbc90126f50d1d5f2da89",
  "frames_sha256_note": "sha256 of the raw RGBA stream sent to the encoder; depends on the drawing, not the encoder build",
  "matplotlib": "3.10.8",
  "numpy": "2.4.4",
  "python": "3.13.12",
  "threads": 2
 },
 "time_mapping": {
  "csv_rows": 601,
  "fps": 24,
  "hold_frames": 48,
  "interpolation": "none: only rows present in the CSV are drawn",
  "linear_in_model_time": true,
  "model_time_per_motion_frame": 0.1791044776119403,
  "model_time_range": [
   0.0,
   60.0
  ],
  "motion_frames": 336,
  "note": "most of the change happens before model time 30; the second half of the video is the settled state",
  "rule": "frame k < motion_frames shows csv row round(k*(rows-1)/(motion_frames-1)); later frames repeat the last row",
  "total_frames": 384
 },
 "video": {
  "bytes": 296736,
  "codec": "h264",
  "duration_s": 16.0,
  "file": "delta_notch_replay.mp4",
  "frames": 384,
  "height": 720,
  "pix_fmt": "yuv420p",
  "r_frame_rate": "24/1",
  "sha256": "2fb5ab69267be62d7a0c50c116227857a1706b8847cf208d582f0897eb62059d",
  "width": 1280
 }
}